United States,7211,Traveler Accommodation,"140,414",42.4,57.6,"59,497","2,063,537",G,"15,275,777",G,"63,801,533",G,"80,917","3,515,016",G
United States,7212,RV (Recreational Vehicle) Parks and Recreational Camps,"14,867",51.4,48.6,"7,649","48,154",G,"284,832",G,"1,690,689",G,"7,218","471,306",G
United States,7213,"Rooming and Boarding Houses, Dormitories, and Workers' Camps","25,950",7.3,92.7,"1,904","9,674",G,"67,232",G,"259,285",G,"24,046","567,735",G
United States,722,Food Services and Drinking Places,"1,011,811",65.6,34.4,"664,084","12,223,775",G,"53,091,454",G,"225,610,173",G,"347,727","14,190,098",G
United States,7223,Special Food Services,"265,711",16.8,83.2,"44,733","823,570",G,"4,526,479",G,"19,741,036",G,"220,978","5,952,456",G
United States,7224,Drinking Places (Alcoholic Beverages),"65,374",61.3,38.7,"40,100","371,773",G,"1,609,347",G,"6,920,522",G,"25,274","1,592,182",G
United States,7225,Restaurants and Other Eating Places,"680,726",85.1,14.9,"579,251","11,028,432",G,"46,955,628",G,"198,948,615",G,"101,475","6,645,460",G
United States,81,Other Services (except Public Administration),"3,744,996",20.5,79.5,"766,761","5,595,744",G,"45,967,415",G,"189,012,306",G,"2,978,235","90,820,212",G
United States,811,Repair and Maintenance,"776,930",28,72,"217,830","1,303,518",G,"13,318,228",G,"55,383,498",G,"559,100","25,240,863",G
United States,8111,Automotive Repair and Maintenance,"475,577",34.1,65.9,"162,285","925,939",G,"8,321,562",G,"34,790,192",G,"313,292","14,893,092",G
United States,8112,Electronic and Precision Equipment Repair and Maintenance,"44,994",27.4,72.6,"12,339","100,976",G,"1,451,665",G,"5,795,095",G,"32,655","1,337,775",G
United States,8113,Commercial and Industrial Machinery and Equipment (except Automotive and Electronic) Repair and Maintenance,"59,563",36.9,63.1,"21,973","203,633",G,"2,961,332",G,"12,254,091",G,"37,590","2,305,605",G
United States,8114,Personal and Household Goods Repair and Maintenance,"196,796",10.8,89.2,"21,233","72,970",G,"583,669",G,"2,544,120",G,"175,563","6,704,391",G
United States,812,Personal and Laundry Services,"2,460,381",9.7,90.3,"239,347","1,504,407",G,"9,312,732",G,"39,148,305",G,"2,221,034","62,311,831",G
United States,8121,Personal Care Services,"1,435,214",9.5,90.5,"136,598","737,544",G,"3,934,167",G,"16,826,107",G,"1,298,616","35,235,900",G
United States,8122,Death Care Services,"36,437",56.9,43.1,"20,739","135,390",G,"1,227,274",G,"5,126,866",G,"15,698","880,794",G
United States,8123,Drycleaning and Laundry Services,"58,097",57.1,42.9,"33,165","283,854",G,"1,964,911",G,"8,215,701",G,"24,932","1,661,310",G
United States,8129,Other Personal Services,"930,633",5.2,94.8,"48,845","347,619",G,"2,186,380",G,"8,979,631",G,"881,788","24,533,827",G
United States,813,"Religious, Grantmaking, Civic, Professional, and Similar Organizations","507,685",61,39,"309,584","2,787,819",G,"23,336,455",G,"94,480,503",G,"198,101","3,267,518",G
United States,8131,Religious Organizations,N,N,N,"185,820","1,693,661",G,"9,435,880",G,"38,394,838",G,N,N,N
United States,8132,Grantmaking and Giving Services,N,N,N,"20,673","195,985",G,"3,081,456",G,"12,610,809",G,N,N,N
United States,8133,Social Advocacy Organizations,N,N,N,"18,379","185,933",G,"2,244,407",G,"9,231,862",G,N,N,N
United States,8134,Civic and Social Organizations,N,N,N,"25,711","218,668",G,"1,241,521",G,"5,232,269",G,N,N,N
United States,8139,"Business, Professional, Labor, Political, and Similar Organizations",N,N,N,"59,001","493,572",G,"7,333,191",G,"29,010,725",G,N,N,N
United States,99,Industries not classified,N,N,N,"12,157","13,875",H,"78,795",G,"448,866",G,N,N,N